{
  "$schema": "https://json-schema.org/draft/2020-12/schema",
  "title": "OpenPhenology terms/1",
  "description": "The licence, what it covers, how to cite and credit, and the contact.",
  "type": "object",
  "required": [
    "id",
    "kind",
    "format",
    "provenance",
    "data"
  ],
  "properties": {
    "id": {
      "description": "The file's path from the API root.",
      "type": "string",
      "pattern": "^terms(/\\d+)?\\.json$"
    },
    "kind": {
      "description": "The format's name, such as `county-weekly`.",
      "const": "terms"
    },
    "format": {
      "description": "Format name and version, for example `county-weekly/1.0`.",
      "type": "string",
      "pattern": "^terms/1\\.\\d+$"
    },
    "provenance": {
      "description": "Where the content came from.",
      "type": "object",
      "required": [
        "release",
        "sources",
        "licences",
        "gbif_download_dois",
        "method",
        "taxonomy",
        "boundaries",
        "ranges",
        "protection",
        "code",
        "run"
      ],
      "properties": {
        "release": {
          "description": "The release the file belongs to, such as `2026-10-19`.",
          "type": "string",
          "pattern": "^\\d{4}-\\d{2}-\\d{2}$"
        },
        "sources": {
          "description": "Source IDs, as listed in `sources.json`.",
          "type": "array",
          "items": {
            "type": "string"
          }
        },
        "licences": {
          "description": "The licences of those sources.",
          "type": "array",
          "items": {
            "type": "string"
          }
        },
        "gbif_download_dois": {
          "description": "The GBIF downloads the records came from, as DOIs.",
          "type": "array",
          "items": {
            "type": "string"
          }
        },
        "method": {
          "description": "The method version, such as `seasonal-3`.",
          "anyOf": [
            {
              "type": "string"
            },
            {
              "type": "null"
            }
          ]
        },
        "taxonomy": {
          "description": "The taxonomy version species keys come from.",
          "anyOf": [
            {
              "type": "string"
            },
            {
              "type": "null"
            }
          ]
        },
        "boundaries": {
          "description": "The boundary version areas come from.",
          "anyOf": [
            {
              "type": "string"
            },
            {
              "type": "null"
            }
          ]
        },
        "ranges": {
          "description": "Each mapped range edition used.",
          "anyOf": [
            {
              "type": "array",
              "items": {
                "type": "string"
              }
            },
            {
              "type": "null"
            }
          ]
        },
        "protection": {
          "description": "The version of each sensitive-species list applied, by list.",
          "anyOf": [
            {
              "type": "object",
              "additionalProperties": {
                "type": "string"
              }
            },
            {
              "type": "null"
            }
          ]
        },
        "code": {
          "description": "The commit of the code that produced the file.",
          "anyOf": [
            {
              "type": "string"
            },
            {
              "type": "null"
            }
          ]
        },
        "run": {
          "description": "The run that produced the file.",
          "anyOf": [
            {
              "type": "string"
            },
            {
              "type": "null"
            }
          ]
        }
      }
    },
    "data": {
      "description": "The content, as the format sets out.",
      "type": "object",
      "required": [
        "licence",
        "licence_url",
        "cite",
        "credit",
        "warranty",
        "contact"
      ],
      "properties": {
        "licence": {
          "description": "The licence of the outputs: `CC-BY-4.0`.",
          "type": "string",
          "minLength": 1
        },
        "licence_url": {
          "description": "Where the licence is published.",
          "type": "string",
          "minLength": 1
        },
        "cite": {
          "description": "How to cite OpenPhenology.",
          "type": "string",
          "minLength": 1
        },
        "credit": {
          "description": "How to credit the sources.",
          "type": "string",
          "minLength": 1
        },
        "warranty": {
          "description": "The disclaimer of warranty.",
          "type": "string",
          "minLength": 1
        },
        "contact": {
          "description": "The contact address.",
          "type": "string",
          "minLength": 1
        },
        "scope": {
          "description": "What the licence covers, as the data rules give it word for word. Added\nin `terms/1.1`, so absent from `terms/1.0` files.",
          "type": "string",
          "minLength": 1
        }
      }
    }
  },
  "allOf": [
    {
      "if": {
        "type": "object",
        "properties": {
          "format": {
            "enum": [
              "terms/1.0"
            ]
          }
        }
      },
      "else": {
        "type": "object",
        "properties": {
          "data": {
            "type": "object",
            "properties": {
              "scope": true
            },
            "required": [
              "scope"
            ]
          }
        }
      }
    }
  ]
}
