{
  "id": "terms.json",
  "kind": "terms",
  "format": "terms/1.1",
  "provenance": {
    "release": "2026-01-05",
    "sources": ["example"],
    "licences": ["CC-BY-4.0"],
    "gbif_download_dois": ["10.0000/example"],
    "method": "test-1",
    "taxonomy": "test-taxonomy",
    "boundaries": "test-boundaries",
    "ranges": null,
    "protection": null,
    "code": "0.0.0",
    "run": "run-1"
  },
  "data": {
    "licence": "CC-BY-4.0",
    "licence_url": "https://creativecommons.org/licenses/by/4.0/",
    "scope": "Made up.",
    "cite": "Made up.",
    "credit": "Made up.",
    "warranty": "Made up.",
    "contact": "nobody@example.test"
  }
}
